Ian Firth;Keynote Address
B. Siebert;Structural Design of Revolving Entrance Doors
Azita Azarnejad;The City of Calgary 12 Street Bridge Replacement and Monitoring
L Rincon;Comparative Analysis for Monitoring Long-Term Behavior of Box Girder Bridges in Colombia
J.E. Andersen;Structural Health Monitoring of the Henry Hudson I89 Bridge - Calibrating a Digital Twin
Konstantinos Tsiotsias;Damage Assessment of a Continuous Hollow Core Deck Bridge Subjected to ASR Activity
D Honfi;A Practical Approach for Supporting Decisions in Bridge Condition Assessment and Monitoring
Brett Sauter;Inspection and Load Rating of P-T Segmental Bridges
Ansgar Schneider;The Structural Dynamics of the World Trade Center Catastrophe
K.C. Terwel;Contributing Human and Organizational Factors for the Failure of Balconies in Maastricht
D.B. Peraza;Tropicana Garage Collapse
Ryszard A. Daniel;Handling Accidents and Calamities in Hydraulic Structures
P ALMEIDA;The Partial Collapse of the Bridge Galeria dos Estados in Brasília, DF, Brazil
Rebecca Napolitano;Quantitative Crack Assessment through Numerical Simulation and Manifold Learning
P. Toivola;Ontology-Based Sharing of Structural Health Monitoring Data
J Rimington;MTA NYCT ESI: Innovation in Design Build Information Management, Passenger Modeling, and VR
Anthony Devito;LaGuardia Airport Design Build Extends Runway Decks for Safety Improvement
Yaoyao ZHANG;Concurrent  Probability of Earthquake and Hurricane
Kan Dang;Comparison of Track-Beam Interaction among Chinese Code , Eurocode and Japanese Code
F Marzella;Restoration of Two Historic Movable Bridges
Kjeld Thomsen;A Selection of Modern Movable Bridges
liu chuanping;Study on Bearing Structure and Joint Seismic Resistance of Large Span Non-Landing Arch on High-Speed
Michael Olipitz;A Universal UHPC Shell Element for Consideration of Future Building with Precast Elements
J.E ERDOGAN;Incremental launching method for Cayirköy bridges, Turkey
Luke Tarasuik;Tawatinâ Bridge - An Extradosed Rail and Pedestrian Bridge
Jindrich Potucek;Top to Down: Palmetto Section 5 SR-826/SR-836 Interchange
Marwan Nader;Design and Construction of the Samuel De Champlain Bridge
M.R. McFadden;Design of Integral Abutment Bridges for a Lateral Slide Replacement
G OSBORNE;Main span closure for the New Champlain Bridge (NCB) – A temporary tower to expedite construction
Wen-Jun Cao;Exploring Potential Benefits of Bridge Condition Assessment in Highway Operations
Arturo Ruiz de Villa Valdes;Design of Structural Systems for Artworks Manufacturing and Installation in Urban Areas
Panuwat Joyklad;Construction Techniques and Development of 1st Monorail System in Thailand
Bidhan Roy;Globalization of Structural Design and Construction in Developing Countries
Søren Gustenhoff Hansen;Anisotropic Concrete Compressive Strength in Existing Structures
Yunpeng Zhang;Effects of Fatigue Damage on Bond Behavior between Corroded Rebar and Concrete
E. Vereecken;Pre-Posterior Analysis of Inspection Strategies Incorporating Degradation of RC Structures
R Antes;Preserving the Past as Society Evolves
Masato Matsumoto;Bridge Health Monitoring by Infrared Thermography
A Trias;The Progress of LiDAR in the Realm of Bridge Assessment
J.H. Lee;Preliminary Safety Evaluation Method of Buildings using Unmanned Aerial Vehicle (UAV)
D Friedman;Hidden Strength in Historic Buildings
Borja Herraiz;Restoration of a Historic Reinforced Concrete Structure with UHPFRC
Marina Traykova;Research in the Application of UHPFRC for Strengthening Existing Structures in Bulgaria
Samard Buddee;Restoration and Conversion of a Historic Building into a New Learning Park
M Wetzel;Stadthöfe Hamburg – Innovative Structural Design between Water, Heritage, and Modern Lifestyle
J Beane;The John F. Kennedy Center for the Performing Arts Expansion
A Vandenbergh;Terra Cotta Flat Arches: A Historic Modern-Day Challenge
Thomas Reynolds;The Krause Gateway Center: We Didn't Think Steel Could Actually Do This
Ricardo Monteiro;Integrated Seismic Risk in Developing Countries: The Case-Studies of Palestine and Algeria
U. Starossek;Eccentric-Wing Flutter Stabilizer – Simplified Analysis and Main Findings
Mitja PAPINUTTI;Aerodynamic Design of the Floating Bridges
Risto Kiviluoma;Equivalent Static Wind Load Procedure for Skew Winds on Large Bridges
A Mikkonen;Design Application and Verification of the Equivalent Static Wind Loads in Bridge Design
A Hatzikyriakou;Multi-Hazard Analysis of Tropical Cyclone Return Periods
T Savery;NYC Transit Flood Resiliency: Case Studies of Recently Completed Mitigation Strategies
M Jackson;Flood Resilience Code Impacts: Case Studies of Recently Complete Projects in New York City
O. Khandel;Deep Learning Based Framework for Long-term Management of Bridges Considering Climate Change Effects
C. Mendez-Galindo;Optimizing the Multi-Hazard Resilience of Bridge and Building Structures
M.L. Turner;Below-Grade Expansion Joints: Challenges and Best Practices
Z.J. Taylor;Objective-Based Equivalent Static Wind Loads for Long-Span Bridges
D Rocchi;Feasibility Study of Wind Tunnel Aeroelastic Tests on Bridges with Floating Towers
J.H. Kim;Determination of Basic Wind Velocity for Wind Load-governed Limit State
Igor Kavrakov;A CFD Study on the Influence of  Deterministic Gusts on the Flutter Velocity of Bridge Decks
S. Maheux;Flutter Analysis Using Quasi-Steady Time-Domain Flutter Derivatives
DP Philipps;TwentyTwo Bishopsgate, London
N Petrioli;London Expanding - Adding Value Through Fine Engineering
Jeffrey Smilow;Designing buildings to deliver city densification over transport infrastructure
Pierre-Olivier Dallaire;Strategy to Assess the Aerodynamic Performance of the Golden Gate Bridge during the Planned Seismic
K Mermigas;Burlington Bay Skyway Hanger Fail-Safe System
Ryo Nakata;Proactive Maintenance Method for Fatigue Cracks to Steel Bridge Deck without Traffic Disruption
R. Navalurkar;Brooklyn Bridge Rehabilitation Program
Caroline Bouvet;Lanciau Bridge – First spatial tubular truss railway bridge
S.B. Cox;Shaded Dome: A Hybrid Air-Supported – Tensile Membrane Structure
Y-W JO;Pier 55, NYC: A Case Study for the Future of Design, Documentation and Fabrication
Mohamed ElGawady;Influence of Water, Alkali Activators, and Curing Regime on the Workability and Compressive Strength
Yoshimichi Kawai;Steel Sheet Shear Walls with Burring Holes for Low- to Mid-Rise Housings
M. A. Elgawady;Fresh and Mechanical Properties of  Zero-Cement One-Part Geopolymer Mortar and Concrete
